title,score,id,url,comms_num,created,body,"timestamp
"
All you people hard coping with GME right now. Stop making shit up and instead help the company.,0,lggsff,https://www.reddit.com/r/wallstreetbets/comments/lggsff/all_you_people_hard_coping_with_gme_right_now/,160,1612943119.0,"Ortex isnt wrong S3 isnt wrong Finra isn't wrong. The squeeze was squoze. stop coming in here with the Q anon GME anon bullshit. Fuck out of here with that garbage. No you arent smarter than Ortex and S3 and understand the market better you fucking 3 week investing mongoloid.

Instead of making shit up to cope why don't you hop on the actual GME DD that occurred here before you tiny brain apes tried to take over.

Ryan Cohen is at the helm of this dying company. YES its a dying company that's why its a high risk high reward play. Could cohen fail? Yes he could and the company could go bankrupt. Do I think it will happen? Not at all especially with this free marketing.

People were doing amazing DD before your screaming drowned them out. Calling gamestop and finding out some stores are shifting into Gamestops 1.5 focused on building pc's and build a pc kiosks.

If you want to make your money back keep it in GME and talk about the upsides and bring actual conversation to the table. Make your voices heard to gamestop management you want them to involve pc building. I think bundling game pass and a built pc at gamestop is a great way to take share away from steam give it to Microsoft and build some capital for gamestop to utilize.

Give feedback on the app, what is easy and hard to use. Join the powerup Pro rewards program. BUY STUFF FROM GAMESTOP. 

Gamestop has a chance to actually be a 20-40B company if they get a stranglehold on pc parts. they have the ability to beat CyberpowerPC and IbuyPower because they can afford lower margins for prebuilt pc's with their already set up distribution centers. They can open stores in all the areas microcenter doesn't exist. Microcenter does 2.5B in revenue with only 25 stores countrywide. that's insane!

Desktop PC market is 8 Billion yearly revenue. Bro that's a lot of market share they can chip away at. 

Seriously stop looking at SI and making up shit to cope and actually help the company turn around to save your investment. GME can be $500 naturally in 5 years with a hardcore turnaround and some of that cohen customer satisfaction up his sleeves. Gamers are sluts for being treated well and cohen specializes in that.",2021-02-10 09:45:19
GME February 2021 Daily Short Sale Volume,0,lgef9v,https://www.reddit.com/r/wallstreetbets/comments/lgef9v/gme_february_2021_daily_short_sale_volume/,36,1612936180.0,"The following data is **not** the short interest report. This shows, as the title implies, the daily short sale volume from 1 February 2021 through to 8 February 2021. I was wondering if any useful insights could be garnered from this data.

[February 2021 Daily Short Sale Volume Files](http://regsho.finra.org/regsho-Index.html)

**FINRA Consolidated NMS (National Market Systems)**

Date|Symbol|ShortVolume|ShortExemptVolume|TotalVolume|Market
:--|:--|:--|:--|:--|:--
20210201|GME|6982444|364890|12820226|B,Q,N.
20210202|GME|16358136|1073011|29733410|B,Q,N.
20210203|GME|9638240|532939|17735739|B,Q,N.
20210204|GME|14272780|869183|28355377|B,Q,N.
20210205|GME|19063724|1106467|34566363|B,Q,N.
20210208|GME|6404809|82425|11348581|B,Q,N.

**Edit:** The link has been fixed.",2021-02-10 07:49:40
"My fear and lack of self trust attributed to me missing out on the TSLA, CRSP, UAV, and GME booms. Don't be like me; find your passion, do your due diligence, and ride it to the moon.🚀🚀📈🚀📈🚀⭐",717,lggnfi,https://www.reddit.com/r/wallstreetbets/comments/lggnfi/my_fear_and_lack_of_self_trust_attributed_to_me/,134,1612942686.0,"Back in March I had 10k(ish) that I was considering throwing down multiple avenues, yet my fear of losing it all drove me to be complacent with what I had and just keep saving. Now, I've got 20 grand in hand; nothing more nothing less, just 20. I have a special ed forces talent (the same one that I see inside of some of you) that could have net me 100's of racks within the year had I believed in myself, yet I blew it by ""playing it safe"". Don't be like me lads. If you have a dream, chase it! Either you'll go to the stars and be happy that you tried or you'll end up back on earth and lose a bit of money that could be made back in a year. Don't let your dreams be dreams, turn your dreams into memes so that you can laugh about how successful you've become.

*this is not financial advice, as I am not a financial advisor. Just a skinny 🦧 who wishes he had more 🍗 to eat.*

Edit: While this ALSO isn't financial advice, it is my opinion and I'd like to make it clear. Please don't trade with anything that you absolutely can't afford to lose, if you have to choose between taking care of necessities/eating and investing then you genuinely shouldn't be investing until you're in a better position financially. Cut back on some frivolous expenditures for a few paychecks/months to build a ""start up fund"" if you REALLY want to get started guilt free, don't go throwing your rent into a $rope in the hopes of being able to get next months rent free.",2021-02-10 09:38:06
I WANT TO GET OFF MR. BONES' WILD RIDE!,534,lggl2a,https://v.redd.it/0s74aeqpejg61,37,1612942488.0,,2021-02-10 09:34:48
About that Finra report.,478,lgggb1,https://www.reddit.com/r/wallstreetbets/comments/lgggb1/about_that_finra_report/,333,1612942083.0,"Edit: And for everyone wondering, I was in no way implying that ortex, s3, etc. are misreading the fucking data.  My bad for inputting the morningstar link, I was editing the post before posting and changing how I was expressing things and didn't remove it.  It has been removed.
  
I was flat out stating that people HERE are going to look at the finra data and read it wrong, seeing potentially higher concentration of short to volume and also not realizing it's a snapshot at a specific time and long sales the same day could mean that there's more short sales reported than there were short positions created, when all is said and done.  

  
  
Taken directly from https://www.finra.org/rules-guidance/notices/information-notice-051019  
Found by going to the short interest reporting page here  
https://www.finra.org/filing-reporting/regulatory-filing-systems/short-interest  
and going to notices and clicking on the top one, which is the newest one  
  
I believe everyone here, from what I've seen, is just looking at the number on the report and say OMG LOOK AT THAT SHORT INTEREST!
  
  
The notice from Finra, however, says that is not an accurate way to read the data.  Bolding of key points below is mine.  
  
FINRA believes that the following three key points about the short sale volume data may help market participants better understand and draw informed conclusions about the data. As discussed below, the data: **(1) does not include any trades that are not publicly disseminated, (2) is not consolidated with exchange data, and (3) does not—and is not intended to—equate to short interest position information.**  
  
  
Keys to Understanding Short Sale Volume Data  
First, as noted above, the data in the Short Sale Files includes only trades that are publicly disseminated and excludes trades that are not publicly disseminated. **As a result, some offsetting buying activity related to reported short selling would not be reflected in the Daily File and may result in the appearance of a higher concentration of short sale to total volume.**  
  
A common example is where a firm is facilitating a customer order to sell long. The firm may elect to first sell an equivalent number of shares from its own trading account to another firm and then purchase the shares from the customer at the same price to fill the outstanding long sale order. Trading in this manner reduces risk for the firm by enabling it to manage its inventory and lock in a price for the customer execution. Although this trading model involves two separate trades—one between the two firms and one between the firm and its customer—the two offsetting trades are executed at the same price to fill a single customer order. Thus, FINRA rules provide for the public dissemination of only one of the trades (the trade between the two firms) so as not to overstate the reported volume.5 If the firm facilitating the customer long sale order has either no position or a short position in the security in its trading account, the trade with the other firm is reported as short and included in the short sale volume calculations in the Daily File. The volume associated with the firm’s purchase from its customer, however, is not reflected in the Daily File. Thus, the firm’s short sale is included in the short sale volume calculations without any indication that it is associated with an offsetting purchase to facilitate a customer long sale.  
  
Second, as noted above, the data is published separately by FINRA for each FINRA trade reporting facility and by each exchange, and is not consolidated. **Thus, to obtain a complete picture of short sale volume to total volume in a particular listed stock, market participants must combine data published by FINRA for each of its trade reporting facilities, as well as data published by the exchanges.**6  
  
For example, suppose that for security ABCD, FINRA published a combined short sale volume of 3,000 shares and total volume of 15,000 shares for all of its trade reporting facilities.7 Viewing only this off-exchange data published by FINRA, the percentage of short sale volume to total volume would appear to be 20%. Suppose, however, that there was also activity for ABCD executed on the New York Stock Exchange (NYSE) that day totaling 125,000 shares, of which 12,000 shares were reported as short. This volume is published by NYSE on its website, separate from the volume published by FINRA. When considered together, the overall percentage of short sale volume to total volume for ABCD that day is 10.7%, which is much lower than the data published on the FINRA website would suggest.  
  
FINRA notes that the SEC has a webpage where market participants can find links to the short sale volume data published by FINRA and the exchanges,8 which may facilitate consolidation of the data and provide market participants a more complete picture. However, some exchanges charge a fee for access to their data.9  
  

Finally, **short sale volume data does not—and is not intended to—equate to reported bi-monthly short interest information.** FINRA rules require firms to report, on a per security basis, the total quantity of shares held as short positions in all customer and proprietary firm accounts twice a month. FINRA publishes the short interest data for OTC equity securities on its website, while the data for listed stocks is published by the exchange on which the stock is listed. **Although some websites redistribute the Daily File and refer to the data as “short interest,” it is not, in fact, the equivalent of reported short interest information.**  
  
**Some market participants mistakenly conclude that the bi-monthly short interest data is understated because the Daily File reflects short sale volume that is much larger than what is reported as short interest. However, short interest data reflects short positions held by market participants at a specific moment in time on two discrete days each month, while the Daily File reflects the aggregate volume of trades executed as short sales on each trade date. Therefore, while the two data sets are related (i.e., short sale volume may ultimately result in a reportable short interest position), they are not necessarily correlated.**  
  
For example, if a firm sells short 1,000 shares of security ABCD, then purchases 1,000 shares of ABCD later the same day, the short sale volume in the Daily File will include the 1,000 shares that were sold short. Because the firm sold short and purchased an equivalent number of shares that day, it did not establish or accumulate a short position in ABCD; thus, its short sale has no impact on the reported short interest in ABCD.",2021-02-10 09:28:03
Do I qualify as a real retard yet?,205,lgg7g4,https://www.reddit.com/r/wallstreetbets/comments/lgg7g4/do_i_qualify_as_a_real_retard_yet/,78,1612941336.0,"&#x200B;

[Rookie numbers, but at least the &#37; looks good.](https://preview.redd.it/er4cgkw9ajg61.png?width=1364&format=png&auto=webp&s=cc78909ec8e7bdc9d8f820dfc2ac656f44d208ef)

**So I'm basically new to the sub.** I was one of the insurgents who flopped into WSB after catching wiffs of sweet nothings, flung my dolla billz into the swirling vortex, and have been lurking/casually participating in this sub over the past few weeks now.

One thing I see is an endless amount of people talking about their losses on 10 shares of AMC or 2 shares of GME. **I'm down a little over 7k on AMC and GME alone right now AND I KNOW THIS IS ROOKIE SHIT.**

In the spirit of the WSB I've only been able to get wiffs of a long-passed fart from, here is my contribution of soft-core loss porn.

Gotta respect the home you barged in to.  


**edit**: Retard confirmation. Can't read good. ""*losses of more than $2,500 or $10,000 USD for options or stocks respectively*."" Apparently I don't understand the word respectively. Guess I need to throw some more into the inferno to make this valid.",2021-02-10 09:15:36
Palantards - taking out the trash,37,lgg6ma,https://v.redd.it/2blsbcr2bjg61,65,1612941265.0,,2021-02-10 09:14:25
GME and AMC short?,0,lgg34i,https://www.reddit.com/r/wallstreetbets/comments/lgg34i/gme_and_amc_short/,139,1612940966.0,"# Gamestop Corp Class A

NYSE:GMELast Price50.31Day Change9.69-16.15%Tue Feb 09, 202104:10 PMUSDBid51.67Bid Size1Ask51.78Ask Size6High57.00Low46.52Volume26.55 milPrev Close60.00Open56.6152WK High483.0052WK Low2.5752W H (Date)01-28-202152W L (Date)04-03-2020Div Yield--Pro Yield--Mkt Cap4.18 bilAvg Vol55.61 milShares69.75 milP/E-129.87P/B12.60P/S0.7564P/CF19.60EPS-4.75Beta1.271D Ret-16.151W Ret-44.101M Ret184.403M Ret337.866M Ret1,1091Y Ret1,2202Y Ret111.333Y Ret47.805Y Ret15.2810Y Ret11.7615Y Ret7.50YTD Ret167.04VWAP50.01Trade ExchCTS OTCRating--FYEJanDPS (ttm)0.0000Ex-Div Date03-14-2019Dividend YTD--**Short Interest 226.42**

&#x200B;

# Amc Entertainment Holdings Inc Class A

NYSE:AMCLast Price--Day Change----%----USDBid--Bid Size--Ask--Ask Size--High--Low--Volume--Prev Close--Open--52WK High20.3652WK Low1.9152W H (Date)01-27-202152W L (Date)01-05-2021Div Yield--Pro Yield0.4900Mkt Cap2.10 bilAvg Vol343.74 milShares339.07 milP/E-1.29P/B--P/S0.2568P/CF--EPS-34.69Beta2.641D Ret-9.521W Ret-53.531M Ret188.793M Ret148.196M Ret30.111Y Ret-5.192Y Ret-28.523Y Ret-17.185Y Ret-14.2110Y Ret--15Y Ret--YTD Ret191.51VWAP--Trade Exch--Rating--FYEDecDPS (ttm)0.2300Ex-Div Date03-06-2020Dividend YTD--**Short Interest38.12**

**Am I reading this wrong or did both AMC and GME get 2x shorted from previous?**

AMC was about 20% and GME was about 90% previously

edit link

[http://finra-markets.morningstar.com/MarketData/EquityOptions/detail.jsp?query=126:0P00011H0G](http://finra-markets.morningstar.com/MarketData/EquityOptions/detail.jsp?query=126:0P00011H0G)

edit 2

People are saying its old but it says 52 week high 482$ and it says last updated February 9

&#x200B;",2021-02-10 09:09:26
GME squeeze has been squoze? I believe so... for now.,0,lgfy5g,https://www.reddit.com/r/wallstreetbets/comments/lgfy5g/gme_squeeze_has_been_squoze_i_believe_so_for_now/,219,1612940571.0,"I am of the opinion that many of the HFs have covered their short positions. This was more or less confirmed by the NYSE short interest report published today.

As seen [here](https://imgur.com/gallery/iZE8xhq) short interest dropped from 132% to 46% from Jan-15 to Jan-29. (EDIT: short percent of freefloat dropped from 132% to 46%)

I pulled out of GME to stop the bleeding (I know, paper hands). I entered at 321.

Since I have made some money back on GME puts. The short interest report published today is a bearish indicator if you were planning on holding out for short squeeze. I'm sorry to say that a short squeeze is less likely than before. It's unlikely that we will reach the same highs as before unless shorts double down again. We will have to keep an eye on the short interest for the foreseeable future.

For now, bearish sentiment around GME is indicated by the [2.78 put/call ratio](https://fintel.io/ss/us/gme).

Today I placed an order after hours for a GME $50 put expiring on 2/19. Not financial advice.

EDIT: [Positions](https://imgur.com/gallery/qY7T3I6) for those asking",2021-02-10 09:02:51
Oh my.. short interest % of float is 42.61,0,lgf7sh,https://i.redd.it/ftvi0nev2jg61.jpg,224,1612938419.0,,2021-02-10 08:26:59
"There were a bunch of people asking me to backtest a trading strategy based on my daily WSB updates. I did something similar a while back, but here's an updated version.",1027,lgfhdn,https://i.redd.it/77codjom2jg61.png,94,1612939197.0,,2021-02-10 08:39:57
Where the next year takes us..,131,lgfgvt,https://www.reddit.com/r/wallstreetbets/comments/lgfgvt/where_the_next_year_takes_us/,69,1612939156.0,"Hope everyone is doing well this fine day. Here are some good and interesting stocks to add to your research list. Not everything has to be A GME AMC bagholder debacle. Where are they now?

Anyways, There are many good plays to watch out for: OPEN,  offers to property sellers through an online process, improves and repairs the properties it purchases, and relists them for sale. Markets are changing folks. People want instant demand. OPEN had a nice runup today but within the next 6 months will be wayyyy better. This is a strong hoousing market play that will shake up the industry. Like uber to taxis. Q4 earning on 4-March-2021. Don't sleep on these guys. Holding long with stocks on this one.

&#x200B;

PLTR. Ive been mentioning this one time and time again. I firmly believe in this company. They have a strong leadership team. They are pulling in big contracts and their financials are looking promising. They havent mooned just yet and I am personally invested in this company. However, I am only mentioning this stock for the potential it has. It is a massive analytic software company that can do amazing things. Their software program combines massive data queries into a seamless almost gamelike visual representation easy for the user to comprehend. Yes they had a nice runup recently do to an IBM partnership. I am holding long with stock since it was $18 and i have LEAPS for Jan 2022.

&#x200B;

A more risky stock with the potential for a large runup is CLOV. If you dont know who Chamath is, he is a legend now and someone i highly respect in the financial world given his background, knowledge, and calling out those hedge funds during the GME debacle. CLOV is a healthcare provider play. Now why is this a risky play? Well with Biden as president of the USA, he plans to decrease medicare eligible age from 65 to 60, I know thats huge. Currently, each week, there are 10,000 new people eligible for medicare. those are some massive numbers, numbering billions added in revenue for the industry. Chamath is on of the major reason behind this stock. He is a person focused on growth. He assisted Facebook back in the early 2000s and look where they are now. His backing of CLOV will put them in the spotlight especially if there are positive changes to medicare (especially since offfering medicare plans is their specialty). Chamath walks the walk and talks the talk. But as always do your own research. I personally invested stock in this company. and i look forward to see where this goes.

&#x200B;

Look at the big picture everyone! Stay positive and ask lots of questions.

&#x200B;

So now what should you do with this information??

TLDR: OPEN, PLTR, CLOV good stocks. DO YOUR OWN DD

&#x200B;

EDIT: Thank you everyone for getting me to 1.0K Karma. Glad i can help this community. And thank you all for the awards. We all deserve something positive in our lives :)",2021-02-10 08:39:16
Definitive PROOF of GME short ladder attack,549,lgf6xk,https://www.reddit.com/r/wallstreetbets/comments/lgf6xk/definitive_proof_of_gme_short_ladder_attack/,122,1612938348.0,"All you retard need shut up and listen to me, I spoke to a friend in finance who has definitive proof of GME short ladder attack. Take a look and tell me this is not true!

[https://imgur.com/a/Nffhx3I](https://imgur.com/a/Nffhx3I)

Hold The line!

🚀🚀🚀🚀🚀🚀🚀🚀🚀

I DIDN'T HEAR NO BELL!💎👐

P.S.: A reminder that this is my opinion and not financial advice. I'm not recommending anything. Look at the data yourself and come to your own opinion.

&#x200B;

Edit: Lol! Can't believe people are so offended by this. I got added to r/ControversialClub for this shitpost. [https://imgur.com/TCUtPgD](https://imgur.com/TCUtPgD)

Ladder Gang for lyf!! ✌️✌️",2021-02-10 08:25:48
RR.L Rolls Royce,152,lgf2bq,https://www.reddit.com/r/wallstreetbets/comments/lgf2bq/rrl_rolls_royce/,174,1612937986.0,"Today RR.L showed up in my app's list of 'popular' stocks. This means lots of volume.  
RR's graph shows a year long decline into the dirt. With the start of the pandemic being quite defined in that decline. But the year leading up to the pandemic wasn't great either.

[https://finance.yahoo.com/news/rolls-royce-sheds-further-500-071940615.html](https://finance.yahoo.com/news/rolls-royce-sheds-further-500-071940615.html)

[https://finance.yahoo.com/news/rolls-royce-facing-2bn-cash-102808030.html](https://finance.yahoo.com/news/rolls-royce-facing-2bn-cash-102808030.html)

[https://finance.yahoo.com/news/rolls-royce-plans-summer-shutdown-192946850.html](https://finance.yahoo.com/news/rolls-royce-plans-summer-shutdown-192946850.html)

Rolls Royce isn't doing so well. They're losing billions. Their stock is in the dirt, and it looks like people have started picking it up, for dirt cheap.

Some day, the pandemic will fizzle out and air travel will pick up. That will cause the demand for jet engines to pick up, and if RR is still alive by then, their stock should start a recovery.  
If one was to invest in Rolls Royce, this might be the time to yolo in and **hope they don't go bankrupt**. And then wait out the pandemic and hope for their recovery. So basicly, it's a really stupid investment. Unless if it works out, then it's not stupid. If RR survives, they might come out the other end with their fat trimmed, ""lean and mean"".

Obviously not financial advice. This is merely an observation. If anything, it might just be interesting to watch how low their stock can go.",2021-02-10 08:19:46
$TLRY $APHA calls since 1/5/2021 got me to over $500k today. Still think it has much upside 🚀🌳🚀🌳🚀🌳🚀,12615,lgeuop,https://v.redd.it/d0demknhzig61,1720,1612937372.0,,2021-02-10 08:09:32
"TAKE THE SUB BACK, DOWNVOTE GME INTO THE GROUND. THIS IS NOT R/WSBGME",0,lgeuf8,https://www.reddit.com/r/wallstreetbets/comments/lgeuf8/take_the_sub_back_downvote_gme_into_the_ground/,126,1612937353.0,"Please for the love of God. I promise you there's more people here sick of their bullshit then there are anyone enjoying it at this point. 

If everyone would just use the DOWN vote button instead of rolling their eyes and scrolling past another repetitive meme, we could clean this place up in no time. 

Theres a dude throwing 6 figure YOLOs at AMD and morons are busy talking about ""iTs gOnNa sQuEeZe"" like they can't pull up a chart and see **the squeeze was squoze** no matter how much fluffy confirmation bias you idiots post a million times a day. 

If they need their confirmation bias so badly, they can search ""GME."" I'm sick of it filling up the front page just because there's a band of idiots hoping they didn't make a massive mistake. I get the bags are heavy and you need help, but suffer silently *please.*",2021-02-10 08:09:13
GME of Thrones,302,lgeqpu,https://v.redd.it/08d6r1atyig61,41,1612937070.0,,2021-02-10 08:04:30
Reddit Forums turn to Cannabis Sector as stocks hit new highs,103,lgu102,https://www.reuters.com/article/us-retail-trading-cannabis-idUSKBN2AA1F1,171,1612993879.0,,2021-02-10 23:51:19
