title,score,id,url,comms_num,created,body,"timestamp
"
No more GME threads....Please,0,lg5cba,https://www.reddit.com/r/wallstreetbets/comments/lg5cba/no_more_gme_threadsplease/,7,1612912297.0,"Dearest Tards,

While you have your breakfast of glue covered crayons, I’d like you to hear my suggestion. 

My girlfriends husband is in this sub and all he’s been doing this past weeks is reading the GME threads and claiming to know exactly what the price of GME ought to be. He’s never visited yahoo finance, and doesn’t even know what an investor relations section is. He listens to Robinhood Snacks podcast which is where he gets all his stock advice from. 

The GME thread is all he is counting on, and it’s giving him an unrealistic expectation that this play is a “sure thing” rather than realizing it’s one of the riskiest bets currently available on the market. 

What’s even more retarded, him and his boys club can not stop publicly announcing every single thought thats on their mind, which means every single player on Wall Street can see exactly how to manipulate these apes. 

The GME thread made sense last week when it got filled 4 times with 100k comments (the limit), but today, it’s an invitation to advertise you’re retardedness and it does more harm than good. 

If newbies need a GME thread to ask questions on, well guess what, every fucking question has already been answered if you just use the fucking search bars. This subreddit is very well organized and we don’t need an extra retarded thread. 

TLDR: no more GME thread. It’s an invitation to coordinate and let’s HF see exactly what you are thinking.",2021-02-10 01:11:37
"This is easy weight boys, keep fucking holding you damn dirty APES",146,lg4mr4,https://i.redd.it/v4get8d6rgg61.jpg,39,1612910271.0,,2021-02-10 00:37:51
I don't care about the money,33,lg7wum,https://www.reddit.com/r/wallstreetbets/comments/lg7wum/i_dont_care_about_the_money/,19,1612919172.0,"So I have a unique outlook on GME and the whole meme stock situation. Unlike some people, I didn't throw my savings into GME or any of the other meme stocks. I put in a few hundred dollars when GME was at 30 and left it there. I'm in no scary financial situation, as a college student I have no mortgage, no giant financial obligations. I've always been an incredibly frugal person and I don't care about getting the huge payday that a lot of you guys are dreaming of.

But I want blood.

I'm sick of all of these Wall Street fuckers getting away with all of the shit they pull. I grew up getting shit on by many privileged assholes who didn't have to work for shit, so maybe I'm just a bitter person. Maybe I'm sick of feeling like all my hard work (Putting in ungodly study hours, doing extra work for ungrateful teachers just to boost my grade a fraction of a whole percent while these privileged fucks could cheat and lie their way through school) is for naught when these hedge fund bitches cry and whine for mommy government to take care of them and get everything handed to them on a silver platter. Or maybe it's just my optimism that makes me want to believe that a normal petson can make a change for this world. I want to help people. I want my life to mean more than than just being a grain of sand in an unfeeling world.

So Fuck Melvin, Fuck Citron, Fuck Wall Street, Fuck Robinhood, Fuck any other cowards that I'm forgetting and GME TO THE MOON 💎👏💎",2021-02-10 03:06:12
AMC-Bad Day To Sell,39,lg7qk8,https://www.reddit.com/r/wallstreetbets/comments/lg7qk8/amcbad_day_to_sell/,35,1612918765.0,"Disclaimer idk anything about money I trade Pogs for Pokémon cards.

FINRA short reports are due 6pm eastern tonight, if you’ve held this long you might as well wait until this evening to find out if the emperor is wearing any clothes or not.

Or sell it at a 50% loss idk I’m not your dad, but I’m at least gonna hold long enough to find out if there is any fuel left in this rocket. If not I’m either gonna liquidate the loss or hold for a post-covid spike, not sure yet.

I am not a financial Doopity doop and this isn’t financial adoopity.",2021-02-10 02:59:25
Hopium maybe ? Gme post in title so you can remove if needed,24,lg7o67,https://www.reddit.com/r/wallstreetbets/comments/lg7o67/hopium_maybe_gme_post_in_title_so_you_can_remove/,19,1612918590.0,"Things are looking down , real down. Today’s data dump will most likely be altered. The fine is small and the potential losses are great. 
I’m doing some simple monkey math here with this post. Literally 3 bananas + 3 bananas type of shit so downvote me if you must.

First and foremost , I don’t believe for a second these suited apes covered any of their shorts made at 3 dollars. Was it 1.5 billion on the initial bet? Who knows anymore. The data here is so skewed I can’t even tell if we are in February , if aliens are real, or this is a simulation. Am I just an extra in Elon’s dream ?

Anyways if it was 1.5 billion at 3 dollars and melvin has half of their shit left which was what 15 billion? 
They need the price under 15 to even cover. (Without counting price increase from covering ) 
Chances are they don’t expect to take a loss here , they want it back under 3. The biggest slap in the face is when they will get profit from this bet ANYWAYS. 
Not selling , fuck my money and fuck melvin and fuck you. Requesting a paper certificate for my fucking shares to wipe my ass with . Diamond encrusted apes stay strong",2021-02-10 02:56:30
Lost all my money because of this scam board and website,0,lg6oli,https://www.reddit.com/r/wallstreetbets/comments/lg6oli/lost_all_my_money_because_of_this_scam_board_and/,209,1612915952.0,"I put all my money and my family's money into GME last week because everywhere said invest GME and I didn't even know what reddit or WSB was. 

Now the stock is almost completely worthless. I bought into the hype and now I have nothing. You keep saying hold, hold. I can't do that when I have bills, mortgages to pay.

You have all ruined my life and everything I have worked for. You all are scam artists and con artists",2021-02-10 02:12:32
"Feb 09, 2021 | Today's Top 25 WSB Tickers",0,lg6jd4,https://www.reddit.com/r/wallstreetbets/comments/lg6jd4/feb_09_2021_todays_top_25_wsb_tickers/,15,1612915577.0,"To help you YOLO your money away, here are all of the tickers mentioned at least 10 times in all the posts within the past 24 hours (and links to their Yahoo Finance page) along with a sentiment analysis percentage:

Ticker | Mentions | Bullish (%) | Neutral (%) | Bearish (%)
:- | :- | :- | :- | :-

Take a look at my [source code](https://github.com/RyanElliott10/wsbtickerbot) and make some contributions if you're interested.",2021-02-10 02:06:17
ALTRIA / MEDMEN (MMEN) / CRESCO LABS (CL) BUYOUY/Merger,27,lg5bou,https://www.reddit.com/r/wallstreetbets/comments/lg5bou/altria_medmen_mmen_cresco_labs_cl_buyouymerger/,21,1612912248.0,"

Thought you retards should get in on this /r/weedstocks tip.. 

MO / MMEN.CN / CL.CN

""Hear me out, and take this rumour with a grain of salt... though I do trust my friend and have known him for 10+ years. He works indirectly for Cronos (Altria), somewhere in logistics and shipping. He also doesn't know much about the industry but shares info because he knows I'm into it.

He says that heads over there have been in contact with ""an American company called Cresco and Medmen"" believe it or not, to Merge/acquire for their shipping/brick & mortar stores once USA laws loosen up.

No more info than that really but the way I look at it (very excitedly), is that This would be Altria's big US play as Cresco had the cultivation, multi state licenses, but most importantly the supply chain via their wholesale strategy, and MedMen has the brick & mortar locations plus licenses.

We all know the old JV Cronos has with MedMen (MMEN [CNSX exchange], (which my buddy had no clue about)

We also know that Cresco supplies mass wholesale west coast cannabis..

Could this leak be why we've seen MMEN shoot up the past week or so?

Disclaimer I've held MedMen bags for a couple years but always thought more would come of the Cronos JV.""",2021-02-10 01:10:48
New Digital Exclusive GPK card inspired by the WSB Community!,643,lgat37,https://i.redd.it/y2rb13593ig61.jpg,50,1612926563.0,,2021-02-10 05:09:23
AMC gang stand up,1387,lg9gxw,https://www.reddit.com/r/wallstreetbets/comments/lg9gxw/amc_gang_stand_up/,336,1612923134.0,"AMC gang wya?

has everyone forgotten about AMC ? why was it just pushed under the radar and no one talks about it anymore? I’m prepared to sit on my investment for a long time in hopes that it pays off, but does anyone have any trajectory for the timeline on when (if at all) it will take place? only media i’ve seen the past few days is people selling at a loss with AMC. I invested over a grand at just under $14/share and i’m down 61%, would love some other autist insight.",2021-02-10 04:12:14
GME Emergency Shareholder Meeting >> Link,687,lg8qxy,https://www.reddit.com/r/wallstreetbets/comments/lg8qxy/gme_emergency_shareholder_meeting_link/,108,1612921338.0,"**If we make it happen, hedge funds  will have to close the short positions that they have lended to each other therefore activate the squeeze.**

[**http://chng.it/NK5B2DMCFW**](http://chng.it/NK5B2DMCFW)

**Edit : From reading the comments, it seems like e-mailing GME is a better way, but this helps as well.**

&#x200B;

**Note** : Pls, ffs, if people want to hold, stfu, if people wanna paper hand and sell, stfu.

**It's none of my or your business**, I personally, from the objective data and metrics that have seen do not think the squeeze hasn't happened and the short haven't covered, by looking at the floating and shorts data ( i'm a retard btw and have no idea what I'm talking about ).

WSB has been about gambling, if you want investing advice, I'd kindly like to offer you r/investing because this sub is of a wide range of people - from people that yolo their houses to people that take profit. Let's not judge each other and enjoy the ride. If you want to be a part of history, cool; if you wanna say ""lmao conspiracy theorists you shouldve sold hahahah"", cool. Idgaf.

Not financial advice.",2021-02-10 03:42:18
Y'all need to let GME happen,3322,lg8pks,https://www.reddit.com/r/wallstreetbets/comments/lg8pks/yall_need_to_let_gme_happen/,380,1612921240.0,"I've been on reddit for 8 (9?) years, and I've seen hype waves come and go, and sometimes these waves of hype influence important changes in the world, economy, and quality of life for some people. GME will be prevalent for awhile, because this is an ongoing battle. We have to let this happen.

I'm holding and buying as I can. And I hope you will be patient and let this economic revolution continue. This could change they way we invest in the future as we discover more about wall st's dirty plays. If anything, the insight we get by fighting back is some of the most valuable DD we can get.

God speed, retards. To Valhalla! 🚀🚀🚀🚀🚀🚀🚀🚀🚀🚀🚀💎💎💎💎💎💎💎💎🙌🙌🙌🙌🙌🙌🙌🙌",2021-02-10 03:40:40
$CGC - A goliath on their last legs.,104,lg4qkd,https://www.reddit.com/r/wallstreetbets/comments/lg4qkd/cgc_a_goliath_on_their_last_legs/,98,1612910591.0,"Hello all,

I will keep this post really simple. Canopy is a weed company in Canada that has lost money for the past 2 years after being semi-acquired by their parent company Constellation Brands. **Canopy is worth 17 billion dollars despite never producing a profit.**

Canopy has burned 1 billion dollars of direct cash burn over the past year and invested roughly another 1 billion in United States and Canadian businesses. These investments have amount to 1.9 goodwill and a horrible cash position at 673m.

&#x200B;

[Sept 30th](https://preview.redd.it/nwnon28ungg61.png?width=716&format=png&auto=webp&s=d4cbe3bd3bae43ca3b36673ace4e81af09cff3a1)

Canopy reported earnings today and stated that they have 1.5B in cash and cash equivalents, a loss of .39 billion (hilarious wording or $390 million) at the end of the quarter today. They have not uploaded their current balance sheet to SEDAR.

So they either have less investments or spent another 170 million in direct cash. Putting us at around 500 million in direct cash.

Hidden in today's earnings/press release -

*As additional consideration for the assets being transferred and the termination of the royalty agreement, Canopy Growth will make a cash payment to CRC of $115 million and issue an aggregate of 3,750,000 commons shares to CRC.*

Canopy will need to spend another 115 million and dilute shareholders to divest from another horrible Canadian business they acquired back in 2018 or whatever. This will hit the books next Q as Canopy Rivers has to vote/agree to that consolidation of capital.

From there, we have $500 million - $115 from this settlement = $375 million in direct cash after this transaction set up for next quarter, and projected cash burn from operations at another $100 million. **To be fair, the CEO has been cutting costs and it is all over the press releases about their efforts.**

Either way, they are at to be fair $275 million in direct cash and 1.2 billion in investments going into next quarter. **They are going to have to raise capital.**

\----

Topic change, well Canopy is in a growth sector. Sales must be booming in Canada, with a population of 35 million people! Yea well, they were. In November, it actually started to decline.

&#x200B;

[Health Canada stats on sales. Credit - https:\/\/thecannalysts.blog\/](https://preview.redd.it/wsgwq37gpgg61.png?width=719&format=png&auto=webp&s=242e9125e3c24d945bb567d7547889305bd86ee9)

\---

Okay, so what about Constellation helping out Canopy. Well If you look at the actual agreement, Constellation extended the payment tranche out to November 2023. So they hold the option to deliver 5 billion dollars to Canopy by November 2023. That's amazing flexibility for Canopy, right?! Yea you would think so, but the reason it was extended is directly related to Constellation's balance sheet right now.

Constellation's last Q:

&#x200B;

[They have 152 million on the books right now. ](https://preview.redd.it/bckpgtjmqgg61.png?width=2161&format=png&auto=webp&s=9a06aac3dff38aa251ec2adaf74b82debfb8a92a)

Now, no one is doubting Constellation's ability to raise cash. They have immense liquidity, but if you actually look at their balance sheet. They have 10 billion in debt. They can either provide shares to Canopy and royally fuck over current STZ shareholders, or take on debt to provide it. **The deal is going to get restructured.** They will never provide 5 BILLION dollars to a company that can turn a profit.

Options Chain:

&#x200B;

[The April 16 35P with 9,000 contracts. ](https://preview.redd.it/pvqg5fw5rgg61.png?width=734&format=png&auto=webp&s=038ee66cafd5aa2033a5e8b127608931da243f76)

There's my position. I am all in bitches. Weed cannot go up forever. The company is worth 17 billion dollars. STZ is not going to provide 5 billion dollars to a company that already accumulated 1.9 billion in goodwill, will need more cash to fund US legalization, and cannot even turn a profit.

Let the puts fly.

&#x200B;

Edit - There is something really weird happening with the 2/19 40P. It has over 41,000 contracts traded in the past 3 hours. It's incredibly irregular. ",2021-02-10 00:43:11
Maybe the real moon was the friends we made along the way.,12,lgo8us,https://www.reddit.com/r/wallstreetbets/comments/lgo8us/maybe_the_real_moon_was_the_friends_we_made_along/,4,1612969623.0,"In all honesty, taking a moment to just appreciate the insanity that this sub gained literally millions and millions of subscribers in about 10 days, took over mass media and social media, made some idiots and sages thousands and in some cases millions of actual dollars is just a beautiful thing. Among those are folks of every political leaning, religion, race, etc. 

Just incredible. Let’s keep going. Sorry for the hippy dippy post, but you deserve it. Ready for lift off in 3...2....",2021-02-10 17:07:03
All I can do is sit here with my 💎🙌,4577,lglcjt,https://v.redd.it/3hyrycakpkg61,162,1612958181.0,,2021-02-10 13:56:21
"Instead of thinking like GME bag holders, start thinking like GME owners",2912,lgjaw7,https://www.reddit.com/r/wallstreetbets/comments/lgjaw7/instead_of_thinking_like_gme_bag_holders_start/,325,1612951185.0,"Many of us here are GME owners now, whether we currently like it or not. But, as owners, you have the potential to vote on company decisions.

The Venn diagram of GME holders and gamers in this subreddit is probably pretty close to being one circle. If we pooled all of our ideas for the company into threads, collectively voted the least retarded ones to the top, and proposed them to management, we could potentially grow the intrinsic value of GameStop ourselves.

Having a subreddit rebuild a company is not unheard of, given what the sub’s already done in the past. What if we could *be* the rocket fuel?",2021-02-10 11:59:45
"Who is the retard, really?",6840,lgh184,https://www.reddit.com/r/wallstreetbets/comments/lgh184/who_is_the_retard_really/,828,1612943849.0,"I own 200+ GME@199. Some shills and boomers like to come in here and call me and my fellow apes retards. Guess what? I bought a bunch of TSLA way back when the same guys said it was retarded. My TSLA stock has since increased with 1700% in value. I thought I’d take some of those profits and join the GME fun, because I like the stock, and I like apes. I will still be thousands of percent plus if GME would hit 0. I don’t believe it will, because something historical is happening and it’s a privilege to be part of it. All you haters will see down the line. Just like you have done with TSLA. 🚀🚀🚀",2021-02-10 09:57:29
Forgot to eat my crayons for breakfast,0,lgty43,https://www.reddit.com/r/wallstreetbets/comments/lgty43/forgot_to_eat_my_crayons_for_breakfast/,5,1612993620.0,"New to the options world, was excited to buy a call. Placed orders yesterday, immediately rejected due to funds not clearing. Dumb brain me keeps yelling at ToS like “the fucking tendies are sitting right here, in the fucking sauce bucket” I never paid attention to the lil’ spoop * telling me about funding restrictions on options under all shit clears. They groomed me with the immediate funding for buying stocks, etc etc. 

TLDR: crayons hard chew, so forget read words, no clean money, can’t buy the shins.",2021-02-10 23:47:00
"After some extensive research, I present to you my master findings for the future of $BB",57,lgtsal,https://v.redd.it/g1slzzr2lng61,15,1612993077.0,,2021-02-10 23:37:57
You're missing another short squeeze play,0,lgswko,https://www.reddit.com/r/wallstreetbets/comments/lgswko/youre_missing_another_short_squeeze_play/,71,1612989990.0,"All of you smooth brained retards wouldn't shut the fuck up about GME long enough to read the small handful of TLRY posts that smarter retards posted. GME is finished, shut the fuck up about it already. This is wallstreetbets, if I see one more ""long-term hold"" post about your fucking GME I'm going to throw poop at my wife's boyfriend. get your money out, make some fuckin plays, and get those tendies back you fucking normies. TLRY is already up 70something percent in a couple of days and you're missing out because you keep masturbating to your massive red dildos from GME.",2021-02-10 22:46:30
BATTLE PLAN! LISTEN UP APES AND DIAMOND HANDS! PAPER HANDS AND SHILLS SHOULD NOT REPLY! THIS CAN BE OUR CHANCE TO MAKE A RETURN TO THE TABLE!,1176,lgp35p,https://www.reddit.com/r/wallstreetbets/comments/lgp35p/battle_plan_listen_up_apes_and_diamond_hands/,156,1612973397.0,"Fist of all, fuck the SEC, Fuck hedgies and fuck Melvin, I have nothing to lose so lets do it!

# This is for those who are on loss, are not selling and are waiting for the squeeze 400$+ either to moon or cover your losses.

As you have have noticed the new reports are out, it may seem that the 120% is out of the table but apes still have a chance.

# This will require work and dedication for those involved.

IF the numbers apes have are any indication to go by apes still have a chance.

Lets talk some numbers:

The reports are of a 78.46% short interest, yet apes can make some interesting math with other numbers.

The  Shares Outstanding is of **69.75M** this is the reported total number of shares in GME this takes into account all shares including those of the company itself and private.

Before the report  **61M** shares were being shorted, this was  at 35$ a share.

according to the Bloomberg terminal that is what professionals use to invest it has now around **21M** or more shares being shorted (**I BELIEVE ITS MUCH MORE AT THIS POINT**). This number surely has changed to a bigger number over the week.

&#x200B;

https://preview.redd.it/rrwhus9eylg61.png?width=731&format=png&auto=webp&s=2be3d9b604c2426d44e2604e59d93299b121c432

# if APE can read keep going...

# The graph below is not 100% accurate as this info varies from source to source (you may have noticed this)

&#x200B;

https://preview.redd.it/ugctwbwfylg61.png?width=1144&format=png&auto=webp&s=a7a56b796d0aae9ed0765460102e345882e6bd2c

This is the max pain theory, what this graph tell us is that with the stock at 70$ or lower most owners stand to lose, meaning there are more positions at that point and higher for buyers. As you can see in red is the majority of the PUT or shorts. This can also mean that most people would be profiting at the 120$ or higher share price. And hedgies will be bleeding again at 120$

**Moar numbers for apes...**

As of **today**, GameStop's [Institutional Ownership](https://www.gurufocus.com/term/InstitutionalOwnership/GME/Institutional-Ownership/GameStop) is **87.86%**.  This number seems to vary from many sources.

# THE PLOT THICKENS

# The outstanding% can be as high as  143.68%

according to the Bloomberg terminal which usually the most accurate place to look at.

&#x200B;

https://preview.redd.it/ux549f3jylg61.png?width=1118&format=png&auto=webp&s=3f8e5d5f8595a00a655f8b9037a3fd282afe5b89

&#x200B;

At the same time it reports a FLOAT of 72%... this mean 72% of the shares are open to the market.

This can only mean that the outstanding% is being manipulated by many maneuvers which surely includes the interest short % and other factors. This tells us that HFs are inflating the outstanding% by many different means, this can mean that the FLOAT is also inflated.

If they have inflated the outstanding so much to 143.68% it makes difficult for then to cover the 78.46% interest. In fact it seems like a very hard task without having to BUY IT HARD!

&#x200B;

# NOW TO THE PLAN!

We need to grow the value above the max pain. Hitting around 120$ will possible trigger another big growth and squeeze!

&#x200B;

# BUT APE IS BROKE APE HAVE NO MOAR MONEY!

&#x200B;

Apes this movement have received global coverage, what I investigated is that the biggest growth in value for GME happened during the time #GAMESTOP and  #GME were trending on twitter.

Apes need to make twitter accounts and make the movement noticeable for the news again.

# APES DO IT!

# THIS WORKS!

# RECAPITULATING

OUTSTANDING% is OVER 143% and the Shorts are 78.46% this means they are in a difficult position to cover their shares, even if with an inflated FLOAT, [ortex](https://www.ortex.com/symbol/NYSE/GME/short_interest) reports a float of 45% which may or not be more accurate than the current inflated float on Bloomberg. According to the MAX PAIN, if apes grow the stock to 120$ HEDGIES WILL BLEED AND HAVE TO START COVERING! THIS WILL TRIGGER ANOTHER SQUEEZE!

&#x200B;

# THE MARKET CLOSED AT  50.31, GETTING TO 120$ IS REALISTIC IF APES GO ON THE ATTACK!

&#x200B;

Lets make the paper hand bitches that sold at loss feel the heat lmao!

&#x200B;

# APES CAN DO IT AGAIN!

not financial advice im retaded",2021-02-10 18:09:57
"Hi Melvin, Hi Capital. This is a negative post. Can I have some money please?",838,lgor3l,https://www.reddit.com/r/wallstreetbets/comments/lgor3l/hi_melvin_hi_capital_this_is_a_negative_post_can/,83,1612971873.0,"I hopped on the GME train quite early. 95 @ 33 dollars. Fuck man, why didn't I sell at 480? Why didn't I sell at 300?

Should have seen this coming. Well played hedge funds, you have won. I knew wsb was about losing money not making it. It was just a conspiracy by this sub to hype up a stock then those hyping it sold at the top leaving all the people they suckered in to holding the bags.

Just kidding

#BUY AND HOLD GME YOU FUCKING RETARDS


76% SHORT INTEREST MY ARSE

Melvin sincerely

🖕

Edit: aahhhh hugs. Fanx!",2021-02-10 17:44:33
Institutional ownership of GME at 205.96%,2996,lgntg0,https://www.reddit.com/r/wallstreetbets/comments/lgntg0/institutional_ownership_of_gme_at_20596/,447,1612967733.0,"Everyone is talking about the 78.46% short interest, but there's another metric that Finra released tonight that's extremely interesting:

Institutional ownership is now at a whopping 205.96%, a net increase of 20,525,480 shares from last report.

[Source](http://finra-markets.morningstar.com/MarketData/EquityOptions/detail.jsp?query=126%3A0P000002CH&sdkVersion=2.58.0)

*edit* The numbers published reflect the settlement date data from Jan 29, so not reflective of current data. But that's still an insane ratio. Institutional ownership over 100% usually signals shortselling. Sure some oversight could be just from delayed filings... but these numbers are staggering. 🥜

[Image](https://i.ibb.co/rMWsMDR/d4f02b4.png)

Credit u/bimble_bee",2021-02-10 16:35:33
